<?xml version="1.0" encoding="utf-8"?>
<!DOCTYPE defines SYSTEM "http://sdocsml.googlecode.com/dtd/1.0a/sdocmldefs.dtd">

<defines>
  <!-- Math fonts -->
  <def m="mathcal"  n="1"><e n="mfont"><attr n="family">mathcal</attr><d>{{0}}</d></e></def>
  <def m="mathfrac" n="1"><e n="mfont"><attr n="family">mathfrac</attr><d>{{0}}</d></e></def>
  <def m="mathbb"   n="1"><e n="mfont"><attr n="family">mathbb</attr><d>{{0}}</d></e></def>
  <def m="mathbf"   n="1"><e n="mfont"><attr n="family">mathbf</attr><d>{{0}}</d></e></def> <!-- Not correct - should be style="mathbf" -->
  <def m="mathtt"   n="1"><e n="mfont"><attr n="family">mathtt</attr><d>{{0}}</d></e></def>
  <def m="mathit"   n="1"><e n="mfont"><attr n="family">mathit</attr><d>{{0}}</d></e></def>
  <def m="mbox"     n="1"><e n="mtext"><d>{{0}}</d></e></def>

  <def m="hat" n="1">
    <desc>This operator accepts exactly one char of the ones listed in accents.xml</desc>
    <e n="mo"><d><lookup>accentable-{{0}}</lookup>{{0}}&#x0302;</d></e>
  </def>
  <def m="bar" n="1">
    <e n="mo"><d><lookup>accentable-{{0}}</lookup>{{0}}&#x0304;</d></e>
  </def>
  <def m="underbar" n="1">
    <e n="mo"><d><lookup>accentable-{{0}}</lookup>{{0}}&#x0332;</d></e> <!--0x332 : Combining Low Line -->
  </def>

  <!-- Math macros-->
  <def m="frac" n="2"> <e n="mfrac"> <e n="mrow"> <d>{{0}}</d> </e> <e n="mrow"> <d>{{1}}</d> </e></e> </def>
  <def m="sqrt" n="1"> <e n="msqrt"> <e n="mrow"> <d>{{0}}</d> </e> </e></def>
  
  <def m="Cup" superscript-arg="yes" subscript-arg="yes">
    <desc>Indexed union; works like sum and prod.</desc> 
    <e n="msubsup">
      <e n="mrow"><e n="mo"><attr n="op">cup</attr></e></e>
      <e n="mrow"><d>{{SUBSCRIPT}}</d></e>
      <e n="mrow"><d>{{SUPERSCRIPT}}</d></e>
    </e>
  </def>
  <def m="Cap" superscript-arg="yes" subscript-arg="yes">
    <desc>Indexed intersection; works like sum and prod.</desc> 
    <e n="msubsup">
      <e n="mrow"><e n="mo"><attr n="op">cap</attr></e></e>
      <e n="mrow"><d>{{SUBSCRIPT}}</d></e>
      <e n="mrow"><d>{{SUPERSCRIPT}}</d></e>
    </e>
  </def>
  <def m="sum" superscript-arg="yes" subscript-arg="yes">
    <e n="msubsup">
      <e n="mrow"><e n="mo"><attr n="op">sum</attr></e></e>
      <e n="mrow"><d>{{SUBSCRIPT}}</d></e>
      <e n="mrow"><d>{{SUPERSCRIPT}}</d></e>
    </e>
  </def>
  
  <def m="prod" superscript-arg="yes" subscript-arg="yes">
    <e n="msubsup">
      <e n="mrow"><e n="mo"><attr n="op">prod</attr></e></e>
      <e n="mrow"><d>{{SUBSCRIPT}}</d></e>
      <e n="mrow"><d>{{SUPERSCRIPT}}</d></e>
    </e>
  </def>
    
  <def m="int" superscript-arg="yes" subscript-arg="yes">
    <e n="msubsup">
      <e n="mrow"><e n="mo"><attr n="op">int</attr></e></e>
      <e n="mrow"><d>{{SUBSCRIPT}}</d></e>
      <e n="mrow"><d>{{SUPERSCRIPT}}</d></e>
    </e>
  </def>

  <def m="vert" n="1"><e n="mfenced"><attr n="open">|</attr><attr n="close">|</attr><d>{{0}}</d></e></def>
  <def m="paren" n="1"><e n="mfenced"><attr n="open">(</attr><attr n="close">)</attr><d>{{0}}</d></e></def>
  <def m="limits"> <e n="mo"><attr n="op">limits</attr></e></def>
  <!-- <def m="notin">  <e n="mo"><d>&notin;</d></e></def> --> <!-- REPLACED BY \not{\in} -->
  <def m="norm" n="1"><e n="mfenced"><attr n="open">||</attr><attr n="close">||</attr><d>{{0}}</d></e></def>
  <def m="abs" n="1"><e n="mfenced"><attr n="open">|</attr><attr n="close">|</attr><d>{{0}}</d></e></def>
        
  <defenv m="braces"><e n="mfenced"><attr n="open">{</attr><attr n="close">}</attr><d>{{BODY}}</d></e></defenv>
  <defenv m="brackets"><e n="mfenced"><attr n="open">[</attr><attr n="close">]</attr><d>{{BODY}}</d></e></defenv>
  <defenv m="parens"><e n="mfenced"><attr n="open">(</attr><attr n="close">)</attr><d>{{BODY}}</d></e></defenv>
  <defenv m="leftbrace"><e n="mfenced"><attr n="open">{</attr><attr n="close"></attr><d>{{BODY}}</d></e></defenv>

  <def m="min" subscript-arg="yes">
    <e n="msub">
      <e n="mrow"><e n="mtext"><d>min</d></e></e>
      <e n="mrow"><d>{{SUBSCRIPT}}</d></e>
    </e>     
  </def>
  <def m="max" subscript-arg="yes">
    <e n="msub">
      <e n="mrow"><e n="mtext"><d>max</d></e></e>
      <e n="mrow"><d>{{SUBSCRIPT}}</d></e>
    </e>     
  </def>
  <def m="sup" subscript-arg="yes">
    <e n="msub">
      <e n="mrow"><e n="mtext"><d>sup</d></e></e>
      <e n="mrow"><d>{{SUBSCRIPT}}</d></e>
    </e>     
  </def>
  <def m="inf" subscript-arg="yes">
    <e n="msub">
      <e n="mrow"><e n="mtext"><d>inf</d></e></e>
      <e n="mrow"><d>{{SUBSCRIPT}}</d></e>
    </e>     
  </def>






  <defenv m="math">
    <desc>Unnumbered math environment.</desc>
    <defines>
      <def m="tt" n="1"><e n="mfont"><attr n="family">mathtt</attr><d>{{0}}</d></e></def>
      <def m="rm" n="1"><e n="mfont"><attr n="family">mathrm</attr><d>{{0}}</d></e></def>
    </defines>
    <e n="math"><d>{{BODY}}</d></e>
  </defenv>
  
  <defenv m="equation" n="1">
    <desc>Numbered math environment.</desc>
    <defines>
      <def m="tt" n="1"><e n="mfont"><attr n="family">mathtt</attr><d>{{0}}</d></e></def>
      <def m="rm" n="1"><e n="mfont"><attr n="family">mathrm</attr><d>{{0}}</d></e></def>
    </defines>
    <e n="math"><attr n="id">{{0}}</attr> <d>{{BODY}}</d></e>
  </defenv>

  <def m="m" n="1">
    <desc>Inline math.</desc>
    <e n="m"><d>{{0}}</d></e>
  </def>


  <!-- Some standard function names -->

  <def m="diag">
    <desc>Diagonal of a square matrix.</desc>
    <e n="mtext"><d>diag</d></e>
  </def>
  
  <def m="Diag">
    <desc>Diagonal matrix from a vector.</desc>
    <e n="mtext"><d>Diag</d></e>
  </def>
  
  <def m="sin">
    <desc>Sinus.</desc>
    <e n="mtext"><d>sin</d></e>
  </def>

  <def m="cos">
    <desc>Sinus.</desc>
    <e n="mtext"><d>cos</d></e>
  </def>
  
</defines>
